{
  "schema_version": "2.2",
  "generated_at": "2026-06-02T07:32:42Z",
  "day": "2025-05-11",
  "window": {
    "utc_start": "2025-05-11",
    "utc_end": "2025-05-11",
    "days": 1
  },
  "summary": {
    "brief": "Goautodial Goadmin Ce — exploitation likelihood rose sharply (EPSS 19% → 39% · rising (+20%)).",
    "bullets": [
      "Goautodial Goadmin Ce — exploitation likelihood rose sharply (EPSS 19% → 39% · rising (+20%))."
    ],
    "counts": {
      "cves": 1,
      "kev": 0,
      "exploit": 0,
      "epss": 1,
      "cvss": 0,
      "patch": 0
    }
  },
  "cves": [
    {
      "cve_id": "CVE-2015-2844",
      "signal_types": [
        "EPSS"
      ],
      "signals": {
        "kev": null,
        "exploit": null,
        "epss": {
          "previous": {
            "score": 0.19472,
            "score_date": "2025-03-30"
          },
          "current": {
            "score": 0.39138,
            "score_date": "2025-05-11"
          },
          "delta": 0.19666
        },
        "cvss": null,
        "patch": null
      },
      "digest": {
        "published": "2015-05-12",
        "description": "The cpanel function in go_site.php in GoAutoDial GoAdmin CE before 3.3-1420434000 allows remote attackers to execute arbitrary commands via the $action portion of the PATH_INFO.",
        "title": "goautodial goadmin_ce",
        "vendor": "goautodial",
        "product": "goadmin_ce",
        "cvss_max": 10.0
      },
      "cve": {
        "id": "CVE-2015-2844",
        "sourceIdentifier": "cve@mitre.org",
        "published": "2015-05-12T19:59:19.933",
        "lastModified": "2026-05-06T22:30:45.220",
        "vulnStatus": "Modified",
        "descriptions": [
          {
            "lang": "en",
            "value": "The cpanel function in go_site.php in GoAutoDial GoAdmin CE before 3.3-1420434000 allows remote attackers to execute arbitrary commands via the $action portion of the PATH_INFO."
          },
          {
            "lang": "es",
            "value": "La función cpanel en go_site.php en GoAutoDial GoAdmin CE anterior a 3.3-1420434000 permite a atacantes remotos ejecutar comandos arbitrarios a través de la porción $action de PATH_INFO."
          }
        ],
        "metrics": {
          "cvssMetricV2": [
            {
              "cvssData": {
                "version": "2.0",
                "vectorString": "AV:N/AC:L/Au:N/C:C/I:C/A:C",
                "baseScore": 10.0,
                "baseSeverity": "HIGH"
              },
              "source": "nvd@nist.gov",
              "type": "Primary",
              "baseSeverity": "HIGH",
              "exploitabilityScore": 10.0,
              "impactScore": 10.0
            }
          ]
        },
        "weaknesses": [
          {
            "type": "Primary",
            "description": [
              {
                "lang": "en",
                "value": "CWE-78"
              }
            ],
            "source": "nvd@nist.gov"
          }
        ],
        "configurations": [
          {
            "nodes": [
              {
                "operator": "OR",
                "negate": false,
                "cpeMatch": [
                  {
                    "vulnerable": true,
                    "criteria": "cpe:2.3:a:goautodial:goadmin_ce:3.0:*:*:*:*:*:*:*",
                    "matchCriteriaId": "9D350AF2-47F1-483B-ADF3-F72FBD5143E8"
                  },
                  {
                    "vulnerable": true,
                    "criteria": "cpe:2.3:a:goautodial:goadmin_ce:3.3:*:*:*:*:*:*:*",
                    "matchCriteriaId": "20303D56-DC23-4A99-AD8F-5493BC4E7238"
                  }
                ]
              }
            ]
          }
        ],
        "references": [
          {
            "url": "http://goautodial.org/news/21",
            "source": "af854a3a-2127-422b-91ae-364da2661108",
            "tags": [
              "Vendor Advisory"
            ]
          },
          {
            "url": "http://packetstormsecurity.com/files/131543/GoAutoDial-SQL-Injection-Command-Execution-File-Upload.html",
            "source": "af854a3a-2127-422b-91ae-364da2661108"
          },
          {
            "url": "http://www.securityfocus.com/archive/1/535319/100/1100/threaded",
            "source": "af854a3a-2127-422b-91ae-364da2661108"
          },
          {
            "url": "http://www.securityfocus.com/bid/74281",
            "source": "af854a3a-2127-422b-91ae-364da2661108"
          },
          {
            "url": "https://www.exploit-db.com/exploits/36807/",
            "source": "af854a3a-2127-422b-91ae-364da2661108",
            "tags": [
              "Exploit"
            ]
          }
        ]
      },
      "risk_score": 86,
      "rank": 1
    }
  ],
  "source": "https://www.cvelogic.com/threat-intelligence/2025-05-11"
}
