{
  "schema_version": "2.2",
  "generated_at": "2026-06-02T07:33:50Z",
  "day": "2025-11-22",
  "window": {
    "utc_start": "2025-11-22",
    "utc_end": "2025-11-22",
    "days": 1
  },
  "summary": {
    "brief": "Miniweb Http Server — exploitation likelihood rose sharply (EPSS 11% → 23% · rising (+11%)).",
    "bullets": [
      "Miniweb Http Server — exploitation likelihood rose sharply (EPSS 11% → 23% · rising (+11%))."
    ],
    "counts": {
      "cves": 1,
      "kev": 0,
      "exploit": 0,
      "epss": 1,
      "cvss": 0,
      "patch": 0
    }
  },
  "cves": [
    {
      "cve_id": "CVE-2008-0337",
      "signal_types": [
        "EPSS"
      ],
      "signals": {
        "kev": null,
        "exploit": null,
        "epss": {
          "previous": {
            "score": 0.11484,
            "score_date": "2025-11-05"
          },
          "current": {
            "score": 0.22732,
            "score_date": "2025-11-22"
          },
          "delta": 0.11248
        },
        "cvss": null,
        "patch": null
      },
      "digest": {
        "published": "2008-01-17",
        "description": "Heap-based buffer overflow in the _mwProcessReadSocket function in http.c in MiniWeb HTTP Server 0.8.19 allows remote attackers to execute arbitrary code via a long URI.",
        "title": "miniweb_http_server miniweb_http_server Buffer Overflow",
        "vendor": "miniweb_http_server",
        "product": "miniweb_http_server",
        "attack_type": "Buffer Overflow",
        "cvss_max": 7.5
      },
      "cve": {
        "id": "CVE-2008-0337",
        "sourceIdentifier": "cve@mitre.org",
        "published": "2008-01-17T22:00:00.000",
        "lastModified": "2026-04-23T00:35:47.467",
        "vulnStatus": "Modified",
        "descriptions": [
          {
            "lang": "en",
            "value": "Heap-based buffer overflow in the _mwProcessReadSocket function in http.c in MiniWeb HTTP Server 0.8.19 allows remote attackers to execute arbitrary code via a long URI."
          },
          {
            "lang": "es",
            "value": "Desbordamiento de búfer basado en pila en la función _mwProcessReadSocket de http.c en MiniWeb HTTP Server 0.8.19 permite a atacantes remotos ejecutar código de su elección mediante un URI largo."
          }
        ],
        "metrics": {
          "cvssMetricV2": [
            {
              "cvssData": {
                "version": "2.0",
                "vectorString": "AV:N/AC:L/Au:N/C:P/I:P/A:P",
                "baseScore": 7.5,
                "baseSeverity": "HIGH"
              },
              "source": "nvd@nist.gov",
              "type": "Primary",
              "baseSeverity": "HIGH",
              "exploitabilityScore": 10.0,
              "impactScore": 6.4
            }
          ]
        },
        "weaknesses": [
          {
            "type": "Primary",
            "description": [
              {
                "lang": "en",
                "value": "CWE-119"
              }
            ],
            "source": "nvd@nist.gov"
          }
        ],
        "configurations": [
          {
            "nodes": [
              {
                "operator": "OR",
                "negate": false,
                "cpeMatch": [
                  {
                    "vulnerable": true,
                    "criteria": "cpe:2.3:a:miniweb_http_server:miniweb_http_server:0.8.19:*:*:*:*:*:*:*",
                    "matchCriteriaId": "AF946D17-6EB5-4DEB-8872-9E8FD8D60940"
                  }
                ]
              }
            ]
          }
        ],
        "references": [
          {
            "url": "http://secunia.com/advisories/28512",
            "source": "af854a3a-2127-422b-91ae-364da2661108",
            "tags": [
              "Vendor Advisory"
            ]
          },
          {
            "url": "http://www.bugtraq.ir/adv/miniweb_english.pdf",
            "source": "af854a3a-2127-422b-91ae-364da2661108",
            "tags": [
              "Exploit"
            ]
          },
          {
            "url": "http://www.securityfocus.com/bid/27319",
            "source": "af854a3a-2127-422b-91ae-364da2661108"
          },
          {
            "url": "http://www.vupen.com/english/advisories/2008/0176",
            "source": "af854a3a-2127-422b-91ae-364da2661108"
          },
          {
            "url": "https://exchange.xforce.ibmcloud.com/vulnerabilities/39718",
            "source": "af854a3a-2127-422b-91ae-364da2661108"
          },
          {
            "url": "https://www.exploit-db.com/exploits/4923",
            "source": "af854a3a-2127-422b-91ae-364da2661108"
          }
        ]
      },
      "risk_score": 81,
      "rank": 1
    }
  ],
  "source": "https://www.cvelogic.com/threat-intelligence/2025-11-22"
}
