{
  "schema_version": "2.2",
  "generated_at": "2026-06-02T07:33:56Z",
  "day": "2025-12-07",
  "window": {
    "utc_start": "2025-12-07",
    "utc_end": "2025-12-07",
    "days": 1
  },
  "summary": {
    "brief": "Zohocorp Manageengine Netflow Analyzer — exploitation likelihood rose sharply (EPSS 8.7% → 24% · rising (+15%)).",
    "bullets": [
      "Zohocorp Manageengine Netflow Analyzer — exploitation likelihood rose sharply (EPSS 8.7% → 24% · rising (+15%))."
    ],
    "counts": {
      "cves": 2,
      "kev": 0,
      "exploit": 0,
      "epss": 2,
      "cvss": 0,
      "patch": 0
    }
  },
  "cves": [
    {
      "cve_id": "CVE-2019-12196",
      "signal_types": [
        "EPSS"
      ],
      "signals": {
        "kev": null,
        "exploit": null,
        "epss": {
          "previous": {
            "score": 0.08693,
            "score_date": "2025-11-21"
          },
          "current": {
            "score": 0.24096,
            "score_date": "2025-12-07"
          },
          "delta": 0.15403
        },
        "cvss": null,
        "patch": null
      },
      "digest": {
        "published": "2019-06-05",
        "description": "A SQL injection vulnerability in /client/api/json/v2/nfareports/compareReport in Zoho ManageEngine NetFlow Analyzer 12.3 allows attackers to execute arbitrary SQL commands via the DeviceID parameter.",
        "title": "zohocorp manageengine_netflow_analyzer SQL Injection",
        "vendor": "zohocorp",
        "product": "manageengine_netflow_analyzer",
        "attack_type": "SQL Injection",
        "cvss_max": 9.8
      },
      "cve": {
        "id": "CVE-2019-12196",
        "sourceIdentifier": "cve@mitre.org",
        "published": "2019-06-05T18:29:01.060",
        "lastModified": "2024-11-21T04:22:24.403",
        "vulnStatus": "Modified",
        "descriptions": [
          {
            "lang": "en",
            "value": "A SQL injection vulnerability in /client/api/json/v2/nfareports/compareReport in Zoho ManageEngine NetFlow Analyzer 12.3 allows attackers to execute arbitrary SQL commands via the DeviceID parameter."
          },
          {
            "lang": "es",
            "value": "Una vulnerabilidad de inyección SQL en la función /client/api/json/v2/nfareports/compareReport en Zoho ManageEngine NetFlow Analyzer versión 12.3, permite a los atacantes ejecutar comandos SQL arbitrarios por medio del parámetro DeviceID."
          }
        ],
        "metrics": {
          "cvssMetricV2": [
            {
              "cvssData": {
                "version": "2.0",
                "vectorString": "AV:N/AC:L/Au:N/C:P/I:P/A:P",
                "baseScore": 7.5,
                "baseSeverity": "HIGH"
              },
              "source": "nvd@nist.gov",
              "type": "Primary",
              "baseSeverity": "HIGH",
              "exploitabilityScore": 10.0,
              "impactScore": 6.4
            }
          ],
          "cvssMetricV30": [
            {
              "cvssData": {
                "version": "3.0",
                "vectorString": "CVSS:3.0/AV:N/AC:L/PR:N/UI:N/S:U/C:H/I:H/A:H",
                "baseScore": 9.8,
                "baseSeverity": "CRITICAL"
              },
              "source": "nvd@nist.gov",
              "type": "Primary",
              "exploitabilityScore": 3.9,
              "impactScore": 5.9
            }
          ]
        },
        "weaknesses": [
          {
            "type": "Primary",
            "description": [
              {
                "lang": "en",
                "value": "CWE-89"
              }
            ],
            "source": "nvd@nist.gov"
          }
        ],
        "configurations": [
          {
            "nodes": [
              {
                "operator": "OR",
                "negate": false,
                "cpeMatch": [
                  {
                    "vulnerable": true,
                    "criteria": "cpe:2.3:a:zohocorp:manageengine_netflow_analyzer:12.3:*:*:*:*:*:*:*",
                    "matchCriteriaId": "5AEFC1D0-45B8-41CE-8B81-A7C44C9AB06F"
                  }
                ]
              }
            ]
          }
        ],
        "references": [
          {
            "url": "http://www.securityfocus.com/bid/108672",
            "source": "af854a3a-2127-422b-91ae-364da2661108"
          },
          {
            "url": "https://www.manageengine.com/products/netflow/readme.html#124029",
            "source": "af854a3a-2127-422b-91ae-364da2661108",
            "tags": [
              "Vendor Advisory"
            ]
          }
        ]
      },
      "risk_score": 86,
      "rank": 1
    },
    {
      "cve_id": "CVE-2005-0873",
      "signal_types": [
        "EPSS"
      ],
      "signals": {
        "kev": null,
        "exploit": null,
        "epss": {
          "previous": {
            "score": 0.55125,
            "score_date": "2025-03-30"
          },
          "current": {
            "score": 0.67385,
            "score_date": "2025-12-07"
          },
          "delta": 0.1226
        },
        "cvss": null,
        "patch": null
      },
      "digest": {
        "published": "2005-05-02",
        "description": "Multiple cross-site scripting (XSS) vulnerabilities in test.jsp in Oracle Reports Server 10g (9.0.4.3.3) allow remote attackers to inject arbitrary web script or HTML via the (1) desname or (2) repprod parameter.",
        "title": "oracle 10g_reports_server XSS",
        "vendor": "oracle",
        "product": "10g_reports_server",
        "attack_type": "XSS",
        "cvss_max": 4.3
      },
      "cve": {
        "id": "CVE-2005-0873",
        "sourceIdentifier": "cve@mitre.org",
        "published": "2005-05-02T04:00:00.000",
        "lastModified": "2026-04-16T00:27:16.627",
        "vulnStatus": "Modified",
        "descriptions": [
          {
            "lang": "en",
            "value": "Multiple cross-site scripting (XSS) vulnerabilities in test.jsp in Oracle Reports Server 10g (9.0.4.3.3) allow remote attackers to inject arbitrary web script or HTML via the (1) desname or (2) repprod parameter."
          }
        ],
        "metrics": {
          "cvssMetricV2": [
            {
              "cvssData": {
                "version": "2.0",
                "vectorString": "AV:N/AC:M/Au:N/C:N/I:P/A:N",
                "baseScore": 4.3,
                "baseSeverity": "MEDIUM"
              },
              "source": "nvd@nist.gov",
              "type": "Primary",
              "baseSeverity": "MEDIUM",
              "exploitabilityScore": 8.6,
              "impactScore": 2.9
            }
          ]
        },
        "weaknesses": [
          {
            "type": "Primary",
            "description": [
              {
                "lang": "en",
                "value": "NVD-CWE-Other"
              }
            ],
            "source": "nvd@nist.gov"
          }
        ],
        "configurations": [
          {
            "nodes": [
              {
                "operator": "OR",
                "negate": false,
                "cpeMatch": [
                  {
                    "vulnerable": true,
                    "criteria": "cpe:2.3:a:oracle:10g_reports_server:9.0.4.3.3:*:*:*:*:*:*:*",
                    "matchCriteriaId": "B8C58A4F-F606-4B7E-8524-517F265D6034"
                  }
                ]
              }
            ]
          }
        ],
        "references": [
          {
            "url": "http://marc.info/?l=bugtraq&m=111168323804203&w=2",
            "source": "af854a3a-2127-422b-91ae-364da2661108"
          },
          {
            "url": "http://secunia.com/advisories/17250",
            "source": "af854a3a-2127-422b-91ae-364da2661108"
          },
          {
            "url": "http://www.kb.cert.org/vuls/id/210524",
            "source": "af854a3a-2127-422b-91ae-364da2661108",
            "tags": [
              "US Government Resource"
            ]
          },
          {
            "url": "http://www.oracle.com/technetwork/topics/security/cpuoct2005-090497.html",
            "source": "af854a3a-2127-422b-91ae-364da2661108"
          },
          {
            "url": "http://www.oracle.com/technology/deploy/security/pdf/public_vuln_to_advisory_mapping.html",
            "source": "af854a3a-2127-422b-91ae-364da2661108"
          },
          {
            "url": "http://www.securityfocus.com/bid/12892",
            "source": "af854a3a-2127-422b-91ae-364da2661108",
            "tags": [
              "Exploit"
            ]
          },
          {
            "url": "http://www.securityfocus.com/bid/15134",
            "source": "af854a3a-2127-422b-91ae-364da2661108"
          },
          {
            "url": "http://www.us-cert.gov/cas/techalerts/TA05-292A.html",
            "source": "af854a3a-2127-422b-91ae-364da2661108",
            "tags": [
              "US Government Resource"
            ]
          }
        ]
      },
      "risk_score": 77,
      "rank": 2
    }
  ],
  "source": "https://www.cvelogic.com/threat-intelligence/2025-12-07"
}
