{
  "schema_version": "2.2",
  "generated_at": "2026-06-29T10:33:12Z",
  "day": "2026-06-27",
  "window": {
    "utc_start": "2026-06-27",
    "utc_end": "2026-06-27",
    "days": 1,
    "calendar": "America/New_York"
  },
  "summary": {
    "brief": "2 material risk changes today across KEV, exploits, critical disclosures, and EPSS movers.",
    "bullets": [
      "2 material risk changes today across KEV, exploits, critical disclosures, and EPSS movers."
    ],
    "counts": {
      "cves": 2,
      "kev": 0,
      "exploit": 0,
      "epss": 0,
      "cvss": 2,
      "patch": 0
    }
  },
  "cves": [
    {
      "cve_id": "CVE-2026-12415",
      "signal_types": [
        "CVSS"
      ],
      "signals": {
        "kev": null,
        "exploit": null,
        "epss": null,
        "cvss": {
          "signal_date": "2026-06-27",
          "previous_max": null,
          "current_max": 9.8
        },
        "patch": null
      },
      "digest": {
        "published": "2026-06-27",
        "last_modified": "2026-06-27",
        "description": "The Invoice Generator plugin for WordPress is vulnerable to privilege escalation due to a missing capability check on the pravel_invoice_edit_account() AJAX action in versions up to, and including, 1.0.0. The handler is exposed via wp_ajax_nopriv_pravel_invoice_edit_account, accepts an attacker-controlled user_id and user_email from POST data, and calls wp_update_user() without verifying authentication, ownership, or a nonce. This makes it possible for unauthenticated attackers to change the email address of any user, including administrators, and then trigger WordPress's password reset flow to gain access to the targeted account.",
        "title": "The Invoice Generator plugin for WordPress is vulnerable to privilege escalation due to a missing capability check on the pravel_invoice_...",
        "attack_type": "Privilege Escalation",
        "cvss_max": 9.8
      },
      "cve": {
        "id": "CVE-2026-12415",
        "sourceIdentifier": "security@wordfence.com",
        "published": "2026-06-27T05:16:41.620",
        "lastModified": "2026-06-27T05:16:41.620",
        "vulnStatus": "Received",
        "descriptions": [
          {
            "lang": "en",
            "value": "The Invoice Generator plugin for WordPress is vulnerable to privilege escalation due to a missing capability check on the pravel_invoice_edit_account() AJAX action in versions up to, and including, 1.0.0. The handler is exposed via wp_ajax_nopriv_pravel_invoice_edit_account, accepts an attacker-controlled user_id and user_email from POST data, and calls wp_update_user() without verifying authentication, ownership, or a nonce. This makes it possible for unauthenticated attackers to change the email address of any user, including administrators, and then trigger WordPress's password reset flow to gain access to the targeted account."
          }
        ],
        "metrics": {
          "cvssMetricV31": [
            {
              "cvssData": {
                "version": "3.1",
                "vectorString": "CVSS:3.1/AV:N/AC:L/PR:N/UI:N/S:U/C:H/I:H/A:H",
                "baseScore": 9.8,
                "baseSeverity": "CRITICAL"
              },
              "source": "security@wordfence.com",
              "type": "Primary",
              "exploitabilityScore": 3.9,
              "impactScore": 5.9
            }
          ]
        },
        "weaknesses": [
          {
            "type": "Primary",
            "description": [
              {
                "lang": "en",
                "value": "CWE-269"
              }
            ],
            "source": "security@wordfence.com"
          }
        ],
        "references": [
          {
            "url": "https://plugins.trac.wordpress.org/browser/invoice-creator/trunk/lib/user-manage-function.php#L184",
            "source": "security@wordfence.com"
          },
          {
            "url": "https://plugins.trac.wordpress.org/browser/invoice-creator/trunk/lib/user-manage-function.php#L193",
            "source": "security@wordfence.com"
          },
          {
            "url": "https://plugins.trac.wordpress.org/browser/invoice-creator/trunk/lib/user-manage-function.php#L203",
            "source": "security@wordfence.com"
          },
          {
            "url": "https://www.wordfence.com/threat-intel/vulnerabilities/id/ee045d0d-101a-4ae2-b209-4a4865eec195?source=cve",
            "source": "security@wordfence.com"
          }
        ]
      },
      "risk_score": 67,
      "rank": 1
    },
    {
      "cve_id": "CVE-2026-58053",
      "signal_types": [
        "CVSS"
      ],
      "signals": {
        "kev": null,
        "exploit": null,
        "epss": null,
        "cvss": {
          "signal_date": "2026-06-27",
          "previous_max": null,
          "current_max": 9.4
        },
        "patch": null
      },
      "digest": {
        "published": "2026-06-27",
        "last_modified": "2026-06-27",
        "description": "Gitea act_runner with the Docker backend (through act 0.262.0) passes a workflow's container.options string to the Docker job container's HostConfig and, when configured with privileged: false, forces only the Privileged flag off while merging options such as --pid=host, --cap-add, and --security-opt unchanged. A user who can run a workflow on a Docker-backed runner can create a job container with host namespaces and broad capabilities and escape to the host as root despite privileged mode being disabled.",
        "title": "Gitea act_runner with the Docker backend (through act 0.262.0) passes a workflow's container.options string to the Docker job container's...",
        "attack_type": "privilege escalation",
        "cvss_max": 9.9
      },
      "cve": {
        "id": "CVE-2026-58053",
        "sourceIdentifier": "disclosure@vulncheck.com",
        "published": "2026-06-28T02:16:32.420",
        "lastModified": "2026-06-28T02:16:32.420",
        "vulnStatus": "Received",
        "descriptions": [
          {
            "lang": "en",
            "value": "Gitea act_runner with the Docker backend (through act 0.262.0) passes a workflow's container.options string to the Docker job container's HostConfig and, when configured with privileged: false, forces only the Privileged flag off while merging options such as --pid=host, --cap-add, and --security-opt unchanged. A user who can run a workflow on a Docker-backed runner can create a job container with host namespaces and broad capabilities and escape to the host as root despite privileged mode being disabled."
          }
        ],
        "metrics": {
          "cvssMetricV31": [
            {
              "cvssData": {
                "version": "3.1",
                "vectorString": "CVSS:3.1/AV:N/AC:L/PR:L/UI:N/S:C/C:H/I:H/A:H",
                "baseScore": 9.9,
                "baseSeverity": "CRITICAL"
              },
              "source": "disclosure@vulncheck.com",
              "type": "Primary",
              "exploitabilityScore": 3.1,
              "impactScore": 6.0
            }
          ],
          "cvssMetricV40": [
            {
              "cvssData": {
                "version": "4.0",
                "vectorString": "CVSS:4.0/AV:N/AC:L/AT:N/PR:L/UI:N/VC:H/VI:H/VA:H/SC:H/SI:H/SA:H/E:X/CR:X/IR:X/AR:X/MAV:X/MAC:X/MAT:X/MPR:X/MUI:X/MVC:X/MVI:X/MVA:X/MSC:X/MSI:X/MSA:X/S:X/AU:X/R:X/V:X/RE:X/U:X",
                "baseScore": 9.4,
                "baseSeverity": "CRITICAL"
              },
              "source": "disclosure@vulncheck.com",
              "type": "Secondary"
            }
          ]
        },
        "weaknesses": [
          {
            "type": "Primary",
            "description": [
              {
                "lang": "en",
                "value": "CWE-269"
              }
            ],
            "source": "disclosure@vulncheck.com"
          }
        ],
        "references": [
          {
            "url": "https://github.com/bikini/exploitarium/tree/main/gitea-act-runner-container-options-poc",
            "source": "disclosure@vulncheck.com"
          },
          {
            "url": "https://www.vulncheck.com/advisories/gitea-act-runner-container-hardening-bypass-via-workflow-container-options",
            "source": "disclosure@vulncheck.com"
          }
        ]
      },
      "risk_score": 66,
      "rank": 2
    }
  ],
  "source": "https://www.cvelogic.com/threat-intelligence/2026-06-27"
}
