{
  "schema_version": "2.2",
  "generated_at": "2026-06-02T07:33:35Z",
  "day": "2025-10-12",
  "window": {
    "utc_start": "2025-10-12",
    "utc_end": "2025-10-12",
    "days": 1
  },
  "summary": {
    "brief": "Quiet day — no material risk changes recorded.",
    "bullets": [
      "No high-signal risk changes in this digest window."
    ],
    "counts": {
      "cves": 0,
      "kev": 0,
      "exploit": 0,
      "epss": 0,
      "cvss": 0,
      "patch": 0
    }
  },
  "cves": [],
  "source": "https://www.cvelogic.com/threat-intelligence/2025-10-12"
}
