{
  "schema_version": "2.2",
  "generated_at": "2026-06-02T07:32:39Z",
  "day": "2025-05-04",
  "window": {
    "utc_start": "2025-05-04",
    "utc_end": "2025-05-04",
    "days": 1
  },
  "summary": {
    "brief": "Netmotionsoftware Netmotion Mobility — exploitation likelihood rose sharply (EPSS 10% → 34% · rising (+24%)).",
    "bullets": [
      "Netmotionsoftware Netmotion Mobility — exploitation likelihood rose sharply (EPSS 10% → 34% · rising (+24%))."
    ],
    "counts": {
      "cves": 1,
      "kev": 0,
      "exploit": 0,
      "epss": 1,
      "cvss": 0,
      "patch": 0
    }
  },
  "cves": [
    {
      "cve_id": "CVE-2021-26915",
      "signal_types": [
        "EPSS"
      ],
      "signals": {
        "kev": null,
        "exploit": null,
        "epss": {
          "previous": {
            "score": 0.1019,
            "score_date": "2025-03-30"
          },
          "current": {
            "score": 0.34158,
            "score_date": "2025-05-04"
          },
          "delta": 0.23968
        },
        "cvss": null,
        "patch": null
      },
      "digest": {
        "published": "2021-02-08",
        "description": "NetMotion Mobility before 11.73 and 12.x before 12.02 allows unauthenticated remote attackers to execute arbitrary code as SYSTEM because of Java deserialization in webrepdb StatusServlet.",
        "title": "netmotionsoftware netmotion_mobility Deserialization",
        "vendor": "netmotionsoftware",
        "product": "netmotion_mobility",
        "attack_type": "Deserialization",
        "cvss_max": 9.3
      },
      "cve": {
        "id": "CVE-2021-26915",
        "sourceIdentifier": "cve@mitre.org",
        "published": "2021-02-08T22:15:12.827",
        "lastModified": "2024-11-21T05:57:02.000",
        "vulnStatus": "Modified",
        "descriptions": [
          {
            "lang": "en",
            "value": "NetMotion Mobility before 11.73 and 12.x before 12.02 allows unauthenticated remote attackers to execute arbitrary code as SYSTEM because of Java deserialization in webrepdb StatusServlet."
          },
          {
            "lang": "es",
            "value": "NetMotion Mobility versiones anteriores a 11.73 y versiones 12.x anteriores a 12.02, permite a atacantes remotos no autenticados ejecutar código arbitrario como SYSTEM debido a una deserialización Java en webrepdb StatusServlet"
          }
        ],
        "metrics": {
          "cvssMetricV2": [
            {
              "cvssData": {
                "version": "2.0",
                "vectorString": "AV:N/AC:M/Au:N/C:C/I:C/A:C",
                "baseScore": 9.3,
                "baseSeverity": "HIGH"
              },
              "source": "nvd@nist.gov",
              "type": "Primary",
              "baseSeverity": "HIGH",
              "exploitabilityScore": 8.6,
              "impactScore": 10.0
            }
          ],
          "cvssMetricV31": [
            {
              "cvssData": {
                "version": "3.1",
                "vectorString": "CVSS:3.1/AV:N/AC:H/PR:N/UI:N/S:U/C:H/I:H/A:H",
                "baseScore": 8.1,
                "baseSeverity": "HIGH"
              },
              "source": "nvd@nist.gov",
              "type": "Primary",
              "exploitabilityScore": 2.2,
              "impactScore": 5.9
            }
          ]
        },
        "weaknesses": [
          {
            "type": "Primary",
            "description": [
              {
                "lang": "en",
                "value": "CWE-502"
              }
            ],
            "source": "nvd@nist.gov"
          }
        ],
        "configurations": [
          {
            "nodes": [
              {
                "operator": "OR",
                "negate": false,
                "cpeMatch": [
                  {
                    "vulnerable": true,
                    "criteria": "cpe:2.3:a:netmotionsoftware:netmotion_mobility:*:*:*:*:*:*:*:*",
                    "matchCriteriaId": "51BC54BA-541A-4750-9CDD-4B1E0C6C4ECD",
                    "versionEndExcluding": "11.73"
                  },
                  {
                    "vulnerable": true,
                    "criteria": "cpe:2.3:a:netmotionsoftware:netmotion_mobility:*:*:*:*:*:*:*:*",
                    "matchCriteriaId": "2CB47E4D-60DF-4973-921C-7D5AF5E2D5DB",
                    "versionStartIncluding": "12.0",
                    "versionEndExcluding": "12.02"
                  }
                ]
              }
            ]
          }
        ],
        "references": [
          {
            "url": "https://ssd-disclosure.com/?p=4676",
            "source": "af854a3a-2127-422b-91ae-364da2661108",
            "tags": [
              "Exploit",
              "Third Party Advisory"
            ]
          },
          {
            "url": "https://ssd-disclosure.com/ssd-advisory-netmotion-mobility-server-multiple-deserialization-of-untrusted-data-lead-to-rce/",
            "source": "af854a3a-2127-422b-91ae-364da2661108",
            "tags": [
              "Exploit",
              "Third Party Advisory"
            ]
          },
          {
            "url": "https://www.netmotionsoftware.com/security-advisories/security-vulnerability-in-mobility-web-server-november-19-2020",
            "source": "af854a3a-2127-422b-91ae-364da2661108",
            "tags": [
              "Vendor Advisory"
            ]
          }
        ]
      },
      "risk_score": 83,
      "rank": 1
    }
  ],
  "source": "https://www.cvelogic.com/threat-intelligence/2025-05-04"
}
