{
  "schema_version": "2.2",
  "generated_at": "2026-06-02T07:32:39Z",
  "day": "2025-05-03",
  "window": {
    "utc_start": "2025-05-03",
    "utc_end": "2025-05-03",
    "days": 1
  },
  "summary": {
    "brief": "1 material risk changes today across KEV, exploits, critical disclosures, and EPSS movers.",
    "bullets": [
      "1 material risk changes today across KEV, exploits, critical disclosures, and EPSS movers."
    ],
    "counts": {
      "cves": 1,
      "kev": 0,
      "exploit": 0,
      "epss": 0,
      "cvss": 1,
      "patch": 0
    }
  },
  "cves": [
    {
      "cve_id": "CVE-2025-3918",
      "signal_types": [
        "CVSS"
      ],
      "signals": {
        "kev": null,
        "exploit": null,
        "epss": null,
        "cvss": {
          "signal_date": "2025-05-03",
          "previous_max": null,
          "current_max": 9.8
        },
        "patch": null
      },
      "digest": {
        "published": "2025-05-03",
        "description": "The Job Listings plugin for WordPress is vulnerable to Privilege Escalation due to improper authorization within the register_action() function in versions 0.1 to 0.1.1. The plugin’s registration handler reads the client-supplied $_POST['user_role'] and passes it directly to wp_insert_user() without restricting to a safe set of roles.  This makes it possible for unauthenticated attackers to elevate their privileges to that of an administrator.",
        "title": "The Job Listings plugin for WordPress is vulnerable to Privilege Escalation due to improper authorization within the register_action() fu...",
        "attack_type": "Privilege Escalation",
        "cvss_max": 9.8
      },
      "cve": {
        "id": "CVE-2025-3918",
        "sourceIdentifier": "security@wordfence.com",
        "published": "2025-05-03T03:15:28.040",
        "lastModified": "2026-04-15T00:35:42.020",
        "vulnStatus": "Deferred",
        "descriptions": [
          {
            "lang": "en",
            "value": "The Job Listings plugin for WordPress is vulnerable to Privilege Escalation due to improper authorization within the register_action() function in versions 0.1 to 0.1.1. The plugin’s registration handler reads the client-supplied $_POST['user_role'] and passes it directly to wp_insert_user() without restricting to a safe set of roles.  This makes it possible for unauthenticated attackers to elevate their privileges to that of an administrator."
          },
          {
            "lang": "es",
            "value": "El complemento Job Listings para WordPress es vulnerable a la escalada de privilegios debido a una autorización incorrecta en la función register_action() en las versiones 0.1 a 0.1.1. El controlador de registro del complemento lee el $_POST['user_role'] proporcionado por el cliente y lo pasa directamente a wp_insert_user() sin restringirlo a un conjunto seguro de roles. Esto permite que atacantes no autenticados eleven sus privilegios a los de administrador."
          }
        ],
        "metrics": {
          "cvssMetricV31": [
            {
              "cvssData": {
                "version": "3.1",
                "vectorString": "CVSS:3.1/AV:N/AC:L/PR:N/UI:N/S:U/C:H/I:H/A:H",
                "baseScore": 9.8,
                "baseSeverity": "CRITICAL"
              },
              "source": "security@wordfence.com",
              "type": "Secondary",
              "exploitabilityScore": 3.9,
              "impactScore": 5.9
            }
          ]
        },
        "weaknesses": [
          {
            "type": "Secondary",
            "description": [
              {
                "lang": "en",
                "value": "CWE-285"
              }
            ],
            "source": "security@wordfence.com"
          }
        ],
        "references": [
          {
            "url": "https://plugins.trac.wordpress.org/browser/job-listings/trunk/includes/forms/class-jlt-form-member.php#L68",
            "source": "security@wordfence.com"
          },
          {
            "url": "https://wordpress.org/plugins/job-listings/#developers",
            "source": "security@wordfence.com"
          },
          {
            "url": "https://www.wordfence.com/threat-intel/vulnerabilities/id/c9cd43f5-c3d0-4eb2-9c18-1af2edca37ff?source=cve",
            "source": "security@wordfence.com"
          }
        ]
      },
      "risk_score": 67,
      "rank": 1
    }
  ],
  "source": "https://www.cvelogic.com/threat-intelligence/2025-05-03"
}
