{
  "schema_version": "2.2",
  "generated_at": "2026-06-02T07:33:42Z",
  "day": "2025-11-02",
  "window": {
    "utc_start": "2025-11-02",
    "utc_end": "2025-11-02",
    "days": 1
  },
  "summary": {
    "brief": "Ipswitch Ws Ftp Server — exploitation likelihood rose sharply (EPSS 32% → 51% · rising (+19%)).",
    "bullets": [
      "Ipswitch Ws Ftp Server — exploitation likelihood rose sharply (EPSS 32% → 51% · rising (+19%))."
    ],
    "counts": {
      "cves": 1,
      "kev": 0,
      "exploit": 0,
      "epss": 1,
      "cvss": 0,
      "patch": 0
    }
  },
  "cves": [
    {
      "cve_id": "CVE-2004-1135",
      "signal_types": [
        "EPSS"
      ],
      "signals": {
        "kev": null,
        "exploit": null,
        "epss": {
          "previous": {
            "score": 0.31938,
            "score_date": "2025-08-14"
          },
          "current": {
            "score": 0.51264,
            "score_date": "2025-11-02"
          },
          "delta": 0.19326
        },
        "cvss": null,
        "patch": null
      },
      "digest": {
        "published": "2005-01-10",
        "description": "Multiple buffer overflows in WS_FTP Server 5.03 2004.10.14 allow remote attackers to cause a denial of service (service crash) via long (1) SITE, (2) XMKD, (3) MKD, and (4) RNFR commands.",
        "title": "ipswitch ws_ftp_server Buffer Overflow",
        "vendor": "ipswitch",
        "product": "ws_ftp_server",
        "attack_type": "Buffer Overflow",
        "cvss_max": 5.0
      },
      "cve": {
        "id": "CVE-2004-1135",
        "sourceIdentifier": "cve@mitre.org",
        "published": "2005-01-10T05:00:00.000",
        "lastModified": "2026-04-16T00:27:16.627",
        "vulnStatus": "Modified",
        "descriptions": [
          {
            "lang": "en",
            "value": "Multiple buffer overflows in WS_FTP Server 5.03 2004.10.14 allow remote attackers to cause a denial of service (service crash) via long (1) SITE, (2) XMKD, (3) MKD, and (4) RNFR commands."
          }
        ],
        "metrics": {
          "cvssMetricV2": [
            {
              "cvssData": {
                "version": "2.0",
                "vectorString": "AV:N/AC:L/Au:N/C:N/I:N/A:P",
                "baseScore": 5.0,
                "baseSeverity": "MEDIUM"
              },
              "source": "nvd@nist.gov",
              "type": "Primary",
              "baseSeverity": "MEDIUM",
              "exploitabilityScore": 10.0,
              "impactScore": 2.9
            }
          ]
        },
        "weaknesses": [
          {
            "type": "Primary",
            "description": [
              {
                "lang": "en",
                "value": "NVD-CWE-Other"
              }
            ],
            "source": "nvd@nist.gov"
          }
        ],
        "configurations": [
          {
            "nodes": [
              {
                "operator": "OR",
                "negate": false,
                "cpeMatch": [
                  {
                    "vulnerable": true,
                    "criteria": "cpe:2.3:a:ipswitch:ws_ftp_server:5.03:*:*:*:*:*:*:*",
                    "matchCriteriaId": "DA85C3EF-DAD2-4383-9E97-65B4D77A73E9"
                  }
                ]
              }
            ]
          }
        ],
        "references": [
          {
            "url": "http://lists.grok.org.uk/pipermail/full-disclosure/2004-November/029600.html",
            "source": "af854a3a-2127-422b-91ae-364da2661108"
          },
          {
            "url": "http://marc.info/?l=bugtraq&m=110177654524819&w=2",
            "source": "af854a3a-2127-422b-91ae-364da2661108"
          },
          {
            "url": "http://www.securiteam.com/exploits/6D00L2KBPG.html",
            "source": "af854a3a-2127-422b-91ae-364da2661108"
          },
          {
            "url": "https://exchange.xforce.ibmcloud.com/vulnerabilities/18296",
            "source": "af854a3a-2127-422b-91ae-364da2661108"
          }
        ]
      },
      "risk_score": 78,
      "rank": 1
    }
  ],
  "source": "https://www.cvelogic.com/threat-intelligence/2025-11-02"
}
