{
  "schema_version": "2.2",
  "generated_at": "2026-06-02T07:32:48Z",
  "day": "2025-05-31",
  "window": {
    "utc_start": "2025-05-31",
    "utc_end": "2025-05-31",
    "days": 1
  },
  "summary": {
    "brief": "WordPress plugin RCE/exploit activity: 2 CVEs flagged today.",
    "bullets": [
      "WordPress plugin RCE/exploit activity: 2 CVEs flagged today."
    ],
    "counts": {
      "cves": 2,
      "kev": 0,
      "exploit": 0,
      "epss": 0,
      "cvss": 2,
      "patch": 0
    }
  },
  "cves": [
    {
      "cve_id": "CVE-2025-4607",
      "signal_types": [
        "CVSS"
      ],
      "signals": {
        "kev": null,
        "exploit": null,
        "epss": null,
        "cvss": {
          "signal_date": "2025-05-31",
          "previous_max": null,
          "current_max": 9.8
        },
        "patch": null
      },
      "digest": {
        "published": "2025-05-31",
        "description": "The PSW Front-end Login & Registration plugin for WordPress is vulnerable to Privilege Escalation in all versions up to, and including, 1.12 via the customer_registration() function. This is due to the use of a weak, low-entropy OTP mechanism in the forget() function. This makes it possible for unauthenticated attackers to initiate a password reset for any user, including administrators, and elevate their privileges for full site takeover.",
        "title": "The PSW Front-end Login & Registration plugin for WordPress is vulnerable to Privilege Escalation in all versions up to, and including, 1...",
        "attack_type": "Privilege Escalation",
        "cvss_max": 9.8
      },
      "cve": {
        "id": "CVE-2025-4607",
        "sourceIdentifier": "security@wordfence.com",
        "published": "2025-05-31T07:15:21.070",
        "lastModified": "2026-04-15T00:35:42.020",
        "vulnStatus": "Deferred",
        "descriptions": [
          {
            "lang": "en",
            "value": "The PSW Front-end Login & Registration plugin for WordPress is vulnerable to Privilege Escalation in all versions up to, and including, 1.12 via the customer_registration() function. This is due to the use of a weak, low-entropy OTP mechanism in the forget() function. This makes it possible for unauthenticated attackers to initiate a password reset for any user, including administrators, and elevate their privileges for full site takeover."
          },
          {
            "lang": "es",
            "value": "El complemento PSW Front-end Login &amp; Registration para WordPress es vulnerable a la escalada de privilegios en todas las versiones hasta la 1.12 incluida, a través de la función customer_registration(). Esto se debe al uso de un mecanismo OTP débil y de baja entropía en la función forget(). Esto permite a atacantes no autenticados iniciar el restablecimiento de contraseña de cualquier usuario, incluidos los administradores, y elevar sus privilegios para obtener el control total del sitio."
          }
        ],
        "metrics": {
          "cvssMetricV31": [
            {
              "cvssData": {
                "version": "3.1",
                "vectorString": "CVSS:3.1/AV:N/AC:L/PR:N/UI:N/S:U/C:H/I:H/A:H",
                "baseScore": 9.8,
                "baseSeverity": "CRITICAL"
              },
              "source": "security@wordfence.com",
              "type": "Secondary",
              "exploitabilityScore": 3.9,
              "impactScore": 5.9
            }
          ]
        },
        "weaknesses": [
          {
            "type": "Secondary",
            "description": [
              {
                "lang": "en",
                "value": "CWE-330"
              }
            ],
            "source": "security@wordfence.com"
          }
        ],
        "references": [
          {
            "url": "https://plugins.trac.wordpress.org/browser/psw-login-and-registration/trunk/public/class-prositegeneralfeatures-public.php#L323",
            "source": "security@wordfence.com"
          },
          {
            "url": "https://plugins.trac.wordpress.org/browser/psw-login-and-registration/trunk/public/class-prositegeneralfeatures-public.php#L493",
            "source": "security@wordfence.com"
          },
          {
            "url": "https://plugins.trac.wordpress.org/browser/psw-login-and-registration/trunk/public/class-prositegeneralfeatures-public.php#L731",
            "source": "security@wordfence.com"
          },
          {
            "url": "https://wordpress.org/plugins/psw-login-and-registration/#developers",
            "source": "security@wordfence.com"
          },
          {
            "url": "https://www.wordfence.com/threat-intel/vulnerabilities/id/a2d6e595-0682-4a41-a432-afbcb50144e8?source=cve",
            "source": "security@wordfence.com"
          }
        ]
      },
      "risk_score": 67,
      "rank": 1
    },
    {
      "cve_id": "CVE-2025-4631",
      "signal_types": [
        "CVSS"
      ],
      "signals": {
        "kev": null,
        "exploit": null,
        "epss": null,
        "cvss": {
          "signal_date": "2025-05-31",
          "previous_max": null,
          "current_max": 9.8
        },
        "patch": null
      },
      "digest": {
        "published": "2025-05-31",
        "description": "The Profitori plugin for WordPress is vulnerable to Privilege Escalation due to a missing capability check on the stocktend_object endpoint in versions 2.0.6.0 to 2.1.1.3. This makes it possible to trigger the save_object_as_user() function for objects whose '_datatype' is set to 'users',. This allows unauthenticated attackers to write arbitrary strings straight into the user’s wp_capabilities meta field, potentially elevating the privileges of an existing user account or a newly created one to that of an administrator.",
        "title": "The Profitori plugin for WordPress is vulnerable to Privilege Escalation due to a missing capability check on the stocktend_object endpoi...",
        "attack_type": "Privilege Escalation",
        "cvss_max": 9.8
      },
      "cve": {
        "id": "CVE-2025-4631",
        "sourceIdentifier": "security@wordfence.com",
        "published": "2025-05-31T07:15:21.263",
        "lastModified": "2026-04-15T00:35:42.020",
        "vulnStatus": "Deferred",
        "descriptions": [
          {
            "lang": "en",
            "value": "The Profitori plugin for WordPress is vulnerable to Privilege Escalation due to a missing capability check on the stocktend_object endpoint in versions 2.0.6.0 to 2.1.1.3. This makes it possible to trigger the save_object_as_user() function for objects whose '_datatype' is set to 'users',. This allows unauthenticated attackers to write arbitrary strings straight into the user’s wp_capabilities meta field, potentially elevating the privileges of an existing user account or a newly created one to that of an administrator."
          },
          {
            "lang": "es",
            "value": "El complemento Profitori para WordPress es vulnerable a la escalada de privilegios debido a la falta de una comprobación de capacidad en el endpoint stocktend_object en las versiones 2.0.6.0 a 2.1.1.3. Esto permite activar la función save_object_as_user() para objetos cuyo `_datatype' esté configurado como `users`. Esto permite a atacantes no autenticados escribir cadenas arbitrarias directamente en el metacampo `wp_capabilities` del usuario, lo que podría elevar los privilegios de una cuenta de usuario existente o de una nueva a los de administrador."
          }
        ],
        "metrics": {
          "cvssMetricV31": [
            {
              "cvssData": {
                "version": "3.1",
                "vectorString": "CVSS:3.1/AV:N/AC:L/PR:N/UI:N/S:U/C:H/I:H/A:H",
                "baseScore": 9.8,
                "baseSeverity": "CRITICAL"
              },
              "source": "security@wordfence.com",
              "type": "Secondary",
              "exploitabilityScore": 3.9,
              "impactScore": 5.9
            }
          ]
        },
        "weaknesses": [
          {
            "type": "Secondary",
            "description": [
              {
                "lang": "en",
                "value": "CWE-285"
              }
            ],
            "source": "security@wordfence.com"
          }
        ],
        "references": [
          {
            "url": "https://plugins.trac.wordpress.org/browser/profitori/tags/2.1.1.3/profitori.php#L2675",
            "source": "security@wordfence.com"
          },
          {
            "url": "https://plugins.trac.wordpress.org/browser/profitori/tags/2.1.1.3/profitori.php#L2679",
            "source": "security@wordfence.com"
          },
          {
            "url": "https://plugins.trac.wordpress.org/browser/profitori/tags/2.1.1.3/profitori.php#L2698",
            "source": "security@wordfence.com"
          },
          {
            "url": "https://plugins.trac.wordpress.org/browser/profitori/tags/2.1.1.3/profitori.php#L3673",
            "source": "security@wordfence.com"
          },
          {
            "url": "https://wordpress.org/plugins/profitori/#developers",
            "source": "security@wordfence.com"
          },
          {
            "url": "https://www.wordfence.com/threat-intel/vulnerabilities/id/c764811f-e9dc-4c3d-b696-5792e70ff0b6?source=cve",
            "source": "security@wordfence.com"
          }
        ]
      },
      "risk_score": 67,
      "rank": 2
    }
  ],
  "source": "https://www.cvelogic.com/threat-intelligence/2025-05-31"
}
